custom_edit_url	sidebar_label	learn_status	learn_rel_path	description
empty	Deployment Guides	Unpublished	Deployment Guides	
empty	Standalone Deployment	Unpublished	Deployment Guides	
empty	Deployment with Centralization Points	Unpublished	Deployment Guides	
empty	Netdata Agent	Unpublished	Netdata Agent	
		Unpublished	Netdata Agent	
https://github.com/netdata/netdata/edit/master/packaging/PLATFORM_SUPPORT.md	Netdata Agent Versions & Platforms	Published	Netdata Agent	Present all the supported platform in the Netdata solution
https://github.com/netdata/netdata/edit/master/packaging/installer/README.md	Installation	Published	Netdata Agent/Installation	
https://github.com/netdata/netdata/edit/master/packaging/installer/methods/kickstart.md	One-Line Installer for All Linux Systems	Published	Netdata Agent/Installation	The kickstart.sh script installs Netdata from source, including all dependencies required to connect to Netdata Cloud, with a single command.
https://github.com/netdata/netdata/edit/master/packaging/installer/methods/packages.md	Native Linux Distribution packages	Published	Netdata Agent/Installation	Instructions for how to install Netdata using native DEB or RPM packages.
https://github.com/netdata/netdata/edit/master/packaging/makeself/README.md	Static binary Linux Packages	Published	Netdata Agent/Installation	Users can build the static 64-bit binary package that we ship with every release of the open-source Netdata Agent for debugging or specialize purposes.
https://github.com/netdata/netdata/edit/master/packaging/docker/README.md	Docker	Published	Netdata Agent/Installation	
https://github.com/netdata/netdata/edit/master/packaging/installer/methods/kubernetes.md	Kubernetes	Published	Netdata Agent/Installation	Deploy Netdata to monitor a Kubernetes cluster to monitor the health, performance, resource utilization, and application metrics of a Kubernetes cluster in real time.
https://github.com/netdata/helmchart/edit/master/charts/netdata/README.md	Kubernetes Helm chart reference	Published	Netdata Agent/Installation	
https://github.com/netdata/netdata/edit/master/docs/category-overview-pages/install-with-a-cicd-provisioning-system.md	Install with a CICD Provisioning System	Published	Netdata Agent/Installation	
https://github.com/netdata/netdata/edit/master/packaging/installer/methods/ansible.md	Ansible	Published	Netdata Agent/Installation	Deploy an infrastructure monitoring solution in minutes with the Netdata Agent and Ansible. Use and customize a simple playbook for monitoring as code.
https://github.com/netdata/netdata/edit/master/packaging/installer/methods/macos.md	macOS	Published	Netdata Agent/Installation	
https://github.com/netdata/netdata/edit/master/packaging/installer/methods/freebsd.md	FreeBSD	Published	Netdata Agent/Installation	Install Netdata on FreeBSD to monitor the health and performance of bare metal or VMs with thousands of real-time, per-second metrics.
https://github.com/netdata/netdata/edit/master/docs/category-overview-pages/install-netdata-on-embedded-systems.md	Install Netdata on Embedded Systems	Published	Netdata Agent/Installation	
https://github.com/netdata/netdata/edit/master/packaging/installer/methods/synology.md	Synology	Published	Netdata Agent/Installation	The Netdata Agent can be installed on AMD64-compatible NAS systems using the 64-bit pre-compiled static binary.
https://github.com/netdata/netdata/edit/master/packaging/installer/methods/manual.md	From a Git checkout	Published	Netdata Agent/Installation	Use the Netdata Agent source code from GitHub, plus helper scripts to set up your system, to install Netdata without packages or binaries.
https://github.com/netdata/netdata/edit/master/packaging/installer/methods/offline.md	Offline systems	Published	Netdata Agent/Installation	Install the Netdata Agent on offline/air gapped systems to benefit from real-time, per-second monitoring without connecting to the internet.
https://github.com/netdata/netdata/edit/master/packaging/installer/methods/aws.md	AWS	Published	Netdata Agent/Installation	The Netdata Agent runs on all popular cloud providers, but often requires additional steps and configuration for full functionality.
https://github.com/netdata/netdata/edit/master/packaging/installer/methods/azure.md	Azure	Published	Netdata Agent/Installation	The Netdata Agent runs on all popular cloud providers, but often requires additional steps and configuration for full functionality.
https://github.com/netdata/netdata/edit/master/packaging/installer/methods/gcp.md	GCP	Published	Netdata Agent/Installation	The Netdata Agent runs on all popular cloud providers, but often requires additional steps and configuration for full functionality.
https://github.com/netdata/netdata/edit/master/packaging/installer/methods/pfsense.md	pfSense	Published	Netdata Agent/Installation	Install Netdata on pfSense to monitor the health and performance of firewalls with thousands of real-time, per-second metrics.
https://github.com/netdata/netdata/edit/master/docs/category-overview-pages/build-the-netdata-agent-yourself.md	Build the Netdata Agent Yourself	Published	Netdata Agent/Installation/Build the Netdata Agent Yourself	
https://github.com/netdata/netdata/edit/master/packaging/maintainers/README.md	Package Maintainers	Published	Netdata Agent/Installation/Build the Netdata Agent Yourself	
https://github.com/netdata/netdata/edit/master/packaging/installer/methods/source.md	Compile from source code	Published	Netdata Agent/Installation/Build the Netdata Agent Yourself	Package maintainers and power users may be interested in manually building Netdata from source without using any of our installation scripts.
https://github.com/netdata/netdata/edit/master/build_external/README.md	External build-system	Published	Netdata Agent/Installation/Build the Netdata Agent Yourself	
https://github.com/netdata/netdata/edit/master/packaging/building-native-packages-locally.md	How to build native (DEB/RPM) packages locally for testing	Published	Netdata Agent/Installation/Build the Netdata Agent Yourself	Instructions for developers who need to build native packages locally for testing.
https://github.com/netdata/netdata/edit/master/contrib/README.md	Netdata contrib	Published	Netdata Agent/Installation/Build the Netdata Agent Yourself	
	Sizing Netdata Agents	Unpublished	Netdata Agent/Sizing Netdata Agents	
	CPU Requirements	Unpublished	Netdata Agent/Sizing Netdata Agents	
	RAM Requirements	Unpublished	Netdata Agent/Sizing Netdata Agents	
	Bandwidth Requirements	Unpublished	Netdata Agent/Sizing Netdata Agents	
	Disk Requirements & Retention	Unpublished	Netdata Agent/Sizing Netdata Agents	
https://github.com/netdata/netdata/edit/master/docs/configure/nodes.md	Configuration	Published	Netdata Agent	Netdata is zero-configuration for most users, but complex infrastructures may require you to tweak some of the Agent's granular settings.
	Netdata Cloud	Unpublished	Netdata Cloud	
	Netdata Cloud Versions	Unpublished	Netdata Cloud	
https://github.com/netdata/netdata/edit/master/docs/netdata-cloud-onprem/getting-started.md	Netdata Cloud On-Prem	Published	Netdata Cloud/Netdata Cloud On-Prem	
	Netdata Cloud On-Prem Installation	Unpublished	Netdata Cloud/Netdata Cloud On-Prem	
https://github.com/netdata/netdata/edit/master/docs/netdata-cloud-onprem/getting-started-light-poc.md	Netdata Cloud On-Prem PoC withouth K8s	Published	Netdata Cloud/Netdata Cloud On-Prem	
https://github.com/netdata/netdata/edit/master/docs/netdata-cloud-onprem/troubleshooting-onprem.md	Netdata Cloud On-Prem Troubleshooting	Published	Netdata Cloud/Netdata Cloud On-Prem	
	Observability Centralization Points	Unpublished	Observability Centralization Points	
	Best Practices for Observability Centralization Points	Unpublished	Observability Centralization Points	
https://github.com/netdata/netdata/edit/master/docs/category-overview-pages/metrics-streaming-and-replication.md	Metrics Centralization Points (Netdata Parents)	Published	Observability Centralization Points/Metrics Centralization Points (Netdata Parents)	
https://github.com/netdata/netdata/edit/master/src/streaming/README.md	Configuring Metrics Centralization Points	Published	Observability Centralization Points/Metrics Centralization Points (Netdata Parents)	
	Sizing Netdata Parents	Unpublished	Observability Centralization Points/Metrics Centralization Points (Netdata Parents)	
	Optimizing Netdata Children	Unpublished	Observability Centralization Points/Metrics Centralization Points (Netdata Parents)	
	Clustering and High Availability of Netdata Parents	Unpublished	Observability Centralization Points/Metrics Centralization Points (Netdata Parents)	
	Replication of Past Samples	Unpublished	Observability Centralization Points/Metrics Centralization Points (Netdata Parents)	
	FAQ on Metrics Cantralization Points	Unpublished	Observability Centralization Points/Metrics Centralization Points (Netdata Parents)	
	Logs Centralization Points with systemd-journald	Unpublished	Observability Centralization Points/Logs Centralization Points with systemd-journald	
https://github.com/netdata/netdata/edit/master/src/collectors/systemd-journal.plugin/passive_journal_centralization_guide_self_signed_certs.md	Passive journal centralization with encryption using self-signed certificates	Published	Observability Centralization Points/Logs Centralization Points with systemd-journald	
https://github.com/netdata/netdata/edit/master/src/collectors/systemd-journal.plugin/passive_journal_centralization_guide_no_encryption.md	Passive journal centralization without encryption	Published	Observability Centralization Points/Logs Centralization Points with systemd-journald	
https://github.com/netdata/netdata/edit/master/src/collectors/systemd-journal.plugin/active_journal_centralization_guide_no_encryption.md	Active journal source without encryption	Published	Observability Centralization Points/Logs Centralization Points with systemd-journald	
	Security and Privacy Design	Unpublished	Security and Privacy Design	
	Netdata Agent Security and Privacy Design	Unpublished	Security and Privacy Design	
	Netdata Cloud Security and Privacy Design	Unpublished	Security and Privacy Design	
				
https://github.com/netdata/netdata/edit/master/docs/category-overview-pages/maintenance-operations-on-netdata-agents.md	Maintaining	Published	Maintaining	
https://github.com/netdata/netdata/edit/master/docs/configure/start-stop-restart.md	Starting and Stopping Netdata Agents 	Published	Maintaining	Manage the Netdata Agent daemon, load configuration changes, and troubleshoot stuck processes on systemd and non-systemd nodes.
https://github.com/netdata/netdata/edit/master/packaging/installer/UPDATE.md	Update Netdata Agents	Published	Maintaining	If you opted out of automatic updates, you need to update your Netdata Agent to the latest nightly or stable version.
https://github.com/netdata/netdata/edit/master/packaging/installer/REINSTALL.md	Reinstall Netdata Agents	Published	Maintaining	Troubleshooting installation issues or force an update of the Netdata Agent by reinstalling it using the same method you used during installation.
https://github.com/netdata/netdata/edit/master/packaging/installer/UNINSTALL.md	Uninstall Netdata Agents	Published	Maintaining	If you are no longer interested in using the Netdata Agent, use the self-contained uninstaller to remove all traces of binaries and configuration files.
https://github.com/netdata/netdata/edit/master/docs/maintenance/backup-restore.md	Backup Netdata Agent's data	Published	Maintaining	Back up all Netdata artifacts
				
https://github.com/netdata/netdata/edit/master/src/collectors/README.md	Data Collection	Published	Data collection	
https://github.com/netdata/netdata/edit/master/docs/collect/system-metrics.md	System metrics	Published	Data collection	Netdata collects thousands of metrics from physical and virtual systems, IoT/edge devices, and containers with zero configuration.
https://github.com/netdata/netdata/edit/master/docs/collect/application-metrics.md	Application metrics	Published	Data collection	Monitor and troubleshoot every application on your infrastructure with per-second metrics, zero configuration, and meaningful charts.
https://github.com/netdata/netdata/edit/master/docs/collect/container-metrics.md	Container metrics	Published	Data collection	Use Netdata to collect per-second utilization and application-level metrics from Linux/Docker containers and Kubernetes clusters.
https://github.com/netdata/netdata/edit/master/src/collectors/COLLECTORS.md	Monitor Anything	Published	Data collection	Netdata gathers real-time metrics from hundreds of data sources using collectors. Most require zero configuration and are pre-configured out of the box.
collectors_integrations				
https://github.com/netdata/netdata/edit/master/docs/category-overview-pages/logs.md	Logs	Published	Logs	
https://github.com/netdata/netdata/edit/master/src/collectors/systemd-journal.plugin/README.md	systemd-journal	Published	Logs/systemd-journal	View and analyze logs available in systemd journal
https://github.com/netdata/netdata/edit/master/src/collectors/systemd-journal.plugin/forward_secure_sealing.md	Forward Secure Sealing (FSS) in Systemd-Journal	Published	Logs/systemd-journal	
https://github.com/netdata/netdata/edit/master/src/collectors/log2journal/README.md	log2journal	Published	Logs/log2journal	
https://github.com/netdata/netdata/edit/master/src/libnetdata/log/systemd-cat-native.md	systemd-cat-native	Published	Logs/systemd-cat-native	
https://github.com/netdata/netdata/edit/master/src/health/README.md	Alerting	Published	Alerting	
https://github.com/netdata/netdata/edit/master/docs/cloud/alerts-configuration-manager.md	Creating Alerts with the Alerts Configuration Manager	Published	Alerting	
https://github.com/netdata/netdata/edit/master/docs/monitor/enable-notifications.md	Notifications	Published	Alerting/Notifications	Send Netdata alerts from a centralized place with Netdata Cloud, or configure nodes individually, to enable incident response and faster resolution.
https://github.com/netdata/netdata/edit/master/src/health/notifications/README.md	Agent Notifications Reference	Published	Alerting/Notifications/Agent Dispatched Notifications	
agent_notifications_integrations				
https://github.com/netdata/netdata/edit/master/docs/cloud/alerts-notifications/notifications.md	Centralized Cloud Notifications Reference	Published	Alerting/Notifications/Centralized Cloud Notifications	Configure Netdata Cloud to send notifications to your team whenever any node on your infrastructure triggers an alert threshold.
https://github.com/netdata/netdata/edit/master/docs/cloud/alerts-notifications/manage-notification-methods.md	Manage notification methods	Published	Alerting/Notifications/Centralized Cloud Notifications	Instructions on how to manage notification methods
https://github.com/netdata/netdata/edit/master/docs/cloud/alerts-notifications/manage-alert-notification-silencing-rules.md	Manage alert notification silencing rules	Published	Alerting/Notifications/Centralized Cloud Notifications	Master Netdata alert management via notification silencing rules for efficient and focused monitoring.
cloud_notifications_integrations				
https://github.com/netdata/netdata/edit/master/src/health/REFERENCE.md	Health Configuration Reference	Published	Alerting	
https://github.com/netdata/netdata/edit/master/src/web/api/health/README.md	Health API Calls	Published	Alerting	
https://github.com/netdata/netdata/edit/master/docs/export/external-databases.md	Exporting quickstart	Published	Exporting	Use the exporting engine to send Netdata metrics to popular external time series databases for long-term storage or further analysis.
https://github.com/netdata/netdata/edit/master/src/exporting/README.md	Exporting reference	Published	Exporting	With the exporting engine, you can archive your Netdata metrics to multiple external databases for long-term storage or further analysis.
https://github.com/netdata/netdata/edit/master/docs/export/enable-connector.md	Enable an exporting connector	Published	Exporting	Learn how to enable and configure any connector using examples to start exporting metrics to external time-series databases in minutes.
https://github.com/netdata/netdata/edit/master/src/exporting/prometheus/README.md	Prometheus	Published	Exporting	Export Netdata metrics to Prometheus for archiving and further analysis.
exporters_integrations				
https://github.com/netdata/netdata/edit/master/src/web/api/exporters/shell/README.md	Shell Scripts	Published	Exporting	
https://github.com/netdata/netdata/edit/master/docs/category-overview-pages/monitor-your-infrastructure.md	Monitor your Infrastructure	Published	Monitor your Infrastructure	
https://github.com/netdata/netdata/edit/master/docs/cloud/manage/sign-in.md	Sign in with email, Google, or GitHub	Published	Monitor your Infrastructure	
https://github.com/netdata/netdata/edit/master/docs/cloud/manage/organize-your-infrastrucutre-invite-your-team.md	Organize your Infrastructure and Invite your Team	Published	Monitor your Infrastructure	
https://github.com/netdata/netdata/edit/master/docs/cloud/visualize/node-filter.md	Node filter	Published	Monitor your Infrastructure	
https://github.com/netdata/netdata/edit/master/docs/cloud/visualize/overview.md	Home, overview and single node view	Published	Monitor your Infrastructure	
https://github.com/netdata/netdata/edit/master/docs/dashboard/visualization-date-and-time-controls.md	Visualization date and time controls	Published	Monitor your Infrastructure	
https://github.com/netdata/netdata/edit/master/docs/monitor/view-active-alerts.md	View active alerts	Published	Monitor your Infrastructure	
https://github.com/netdata/netdata/edit/master/docs/cloud/manage/plans.md	Netdata plans	Published	Monitor your Infrastructure	
https://github.com/netdata/netdata/edit/master/docs/cloud/manage/view-plan-billing.md	View Plan & Billing	Published	Monitor your Infrastructure	
https://github.com/netdata/netdata/edit/master/docs/cloud/manage/themes.md	Choose your Netdata Cloud theme	Published	Monitor your Infrastructure	
				
				
				
https://github.com/netdata/netdata/edit/master/docs/category-overview-pages/netdata-dashboards-and-visualizations.md	Visualizations	Published	Visualizations	
https://github.com/netdata/netdata/edit/master/docs/category-overview-pages/accessing-netdata-dashboards.md	Accessing Netdata Dashboards	Published	Visualizations	
https://github.com/netdata/netdata/edit/master/docs/cloud/visualize/interact-new-charts.md	Netdata Charts	Published	Visualizations	
https://github.com/netdata/netdata/edit/master/docs/dashboard/dimensions-contexts-families.md	Chart dimensions, contexts, and families	Unpublished	Visualizations	 Netdata organizes charts into dimensions, contexts, and families to automaticallyand meaningfully organize thousands of metrics into interactive charts.
https://github.com/netdata/netdata/edit/master/docs/cloud/visualize/dashboards.md	Custom Dashboards	Published	Visualizations	Design new dashboards that target your infrastructure's unique needs and share them with your team fortargeted visual anomaly detection or incident response.
https://github.com/netdata/netdata/edit/master/docs/cloud/visualize/nodes.md	Nodes Tab	Published	Visualizations	See charts from all your nodes in one pane of glass, then dive in to embedded dashboards for granular troubleshooting of ongoing issues.
https://github.com/netdata/netdata/edit/master/docs/visualize/overview-infrastructure.md	Infrastructure Overview	Published	Visualizations	With Netdata Cloud's War Rooms, you can see real-time metrics, from any number of nodes in your infrastructure, in composite charts.
https://github.com/netdata/netdata/edit/master/docs/cloud/visualize/kubernetes.md	Kubernetes visualizations	Published	Visualizations	Netdata Cloud features rich, zero-configuration Kubernetes monitoring for the resource utilization and application metrics of Kubernetes (k8s) clusters.
https://github.com/netdata/netdata/edit/master/docs/cloud/netdata-functions.md	Functions	Published	Visualizations	Present the Netdata Functions what these are and why they should be used.
https://github.com/netdata/netdata/edit/master/docs/cloud/insights/events-feed.md	Events feed	Published	Visualizations	Present the Netdata Events feed.
https://github.com/netdata/netdata-grafana-datasource-plugin/edit/master/README.md	Grafana data source plugin	Published	Visualizations	
https://github.com/netdata/netdata/edit/master/src/web/gui/confluence/README.md	Atlassian Confluence dashboards	Published	Visualizations	
https://github.com/netdata/netdata/edit/master/src/web/gui/README.md	Legacy Agent Dashboard	Published	Visualizations	The local Netdata Agent dashboard is the heart of health monitoring and performance troubleshooting, with hundreds of real-time charts.
https://github.com/netdata/netdata/edit/master/docs/category-overview-pages/machine-learning-and-assisted-troubleshooting.md	ML and Troubleshooting	Published	ML and Troubleshooting	
https://github.com/netdata/netdata/edit/master/docs/cloud/insights/metric-correlations.md	Metric Correlations	Published	ML and Troubleshooting	Quickly find metrics and charts closely related to a particular timeframe of interest anywhere in your infrastructure to discover the root cause faster.
https://github.com/netdata/netdata/edit/master/docs/cloud/netdata-assistant.md	AI powered troubleshooting assistant	Published	ML and Troubleshooting	
https://github.com/netdata/netdata/edit/master/docs/cloud/insights/anomaly-advisor.md	Anomaly Advisor	Published	ML and Troubleshooting	Quickly find anomalous metrics anywhere in your infrastructure.
https://github.com/netdata/netdata/edit/master/src/ml/README.md	Machine learning (ML) powered anomaly detection	Published	ML and Troubleshooting	This is an in-depth look at how Netdata uses ML to detect anomalies.
https://github.com/netdata/netdata/edit/master/docs/cloud/runtime-troubleshooting-with-functions.md	Run-time troubleshooting with Functions	Published	ML and Troubleshooting	Instructions on how to use Functions
https://github.com/netdata/netdata/edit/master/docs/category-overview-pages/netdata-apis.md	REST API	Published	REST API	
https://github.com/netdata/netdata/edit/master/src/web/api/README.md	API	Published	REST API	
https://github.com/netdata/netdata/edit/master/src/web/api/queries/README.md	Queries	Published	REST API/Queries	
https://github.com/netdata/netdata/edit/master/src/web/api/queries/average/README.md	Average or Mean	Published	REST API/Queries	
https://github.com/netdata/netdata/edit/master/src/web/api/queries/countif/README.md	CountIf	Published	REST API/Queries	
https://github.com/netdata/netdata/edit/master/src/web/api/queries/des/README.md	Double exponential smoothing	Published	REST API/Queries	
https://github.com/netdata/netdata/edit/master/src/web/api/queries/incremental_sum/README.md	Incremental Sum (`incremental_sum`)	Published	REST API/Queries	
https://github.com/netdata/netdata/edit/master/src/web/api/queries/max/README.md	Max	Published	REST API/Queries	
https://github.com/netdata/netdata/edit/master/src/web/api/queries/median/README.md	Median	Published	REST API/Queries	Use median in API queries and health entities to find the 'middle' value from a sample, eliminating any unwanted spikes in the returned metrics.
https://github.com/netdata/netdata/edit/master/src/web/api/queries/min/README.md	Min	Published	REST API/Queries	
https://github.com/netdata/netdata/edit/master/src/web/api/queries/percentile/README.md	Percentile	Published	REST API/Queries	Use percentile in API queries and health entities to find the 'percentile' value from a sample, eliminating any unwanted spikes in the returned metrics.
https://github.com/netdata/netdata/edit/master/src/web/api/queries/ses/README.md	Single (or Simple) Exponential Smoothing (`ses`)	Published	REST API/Queries	
https://github.com/netdata/netdata/edit/master/src/web/api/queries/stddev/README.md	Standard deviation (`stddev`)	Published	REST API/Queries	
https://github.com/netdata/netdata/edit/master/src/web/api/queries/sum/README.md	Sum	Published	REST API/Queries	
https://github.com/netdata/netdata/edit/master/src/web/api/queries/trimmed_mean/README.md	Trimmed Mean	Published	REST API/Queries	Use trimmed-mean in API queries and health entities to find the average value from a sample, eliminating any unwanted spikes in the returned metrics.
https://github.com/netdata/netdata/edit/master/src/web/api/formatters/README.md	Formatters	Published	REST API/Formatters	
https://github.com/netdata/netdata/edit/master/src/web/api/formatters/csv/README.md	CSV formatter	Published	REST API/Formatters	
https://github.com/netdata/netdata/edit/master/src/web/api/formatters/json/README.md	JSON formatter	Published	REST API/Formatters	
https://github.com/netdata/netdata/edit/master/src/web/api/formatters/ssv/README.md	SSV formatter	Published	REST API/Formatters	
https://github.com/netdata/netdata/edit/master/src/web/api/formatters/value/README.md	Value formatter	Published	REST API/Formatters	
https://github.com/netdata/netdata/edit/master/src/web/api/badges/README.md	Netdata badges	Published	REST API	
				
				
				
https://github.com/netdata/netdata/edit/master/docs/cloud/cheatsheet.md	Configuring	Published	Developer and Contributor Corner/Configuring	Connecting an Agent to the Cloud allows a Netdata Agent, running on a distributed node, to securely connect to Netdata Cloud via the encrypted Agent-Cloud link (ACLK).'
https://github.com/netdata/netdata/edit/master/docs/configure/common-changes.md	Common configuration changes	Published	Developer and Contributor Corner/Configuring	See the most popular configuration changes to make to the Netdata Agent, including longer metrics retention, reduce sampling, and more.
